SNo,Review_ID,Review_Title,Review_Text,Rating,Date_Time,Reviewer_Name,Location,Product_Name,Category,Verified_Purchase,Site,Source_File
521,FK_20251011_135433_5,Nice product,Good product and nice color.READ MORE,4.0,"May, 2022",Rahul Singh,,Portronics POR-1569 Combo Set  (Grey),,Yes,Flipkart,70.csv
522,FK_20251011_144038_6,Really Nice,Best price of this productREAD MORE,4.0,"Oct, 2022",Puneet kumar,,Thomson 7.5 kg 5 Star Aqua Magic Semi Automatic Top Load Washing Machine Black  (TSA7500SP),,Yes,Flipkart,245.csv
523,FK_20251011_144038_7,Very Good,"Good product, but no-one comes for installation,READ MORE",4.0,"Feb, 2024",Manesha M,,Thomson 7.5 kg 5 Star Aqua Magic Semi Automatic Top Load Washing Machine Black  (TSA7500SP),,Yes,Flipkart,245.csv
524,FK_20251011_144038_4,Value-for-money,"GOOD PRODUCT IN THIS PRICE RANGE------------------------------------------------------------------I am writing this review after one day of use, the product is no doubt value for money in this price range. At first I will tell you the prose the product and then the cons of the product.PROSE : 1. The built quality is enough at this price range of 6.5 K2. As it is a semi-automatic washing machine you can add clothes at anytime of the running cycle.3. The cleanness of the cloth is super. Bu...READ MORE",4.0,"Oct, 2022",Supriyo Saha,RAVI RAJ KUMAR,Thomson 7.5 kg 5 Star Aqua Magic Semi Automatic Top Load Washing Machine Black  (TSA7500SP),,Yes,Flipkart,245.csv
525,FK_20251011_144038_5,Value-for-money,"GOOD PRODUCT IN THIS PRICE RANGE------------------------------------------------------------------I am writing this review after one day of use, the product is no doubt value for money in this price range. At first I will tell you the prose the product and then the cons of the product.PROSE : 1. The built quality is enough at this price range of 6.5 K2. As it is a semi-automatic washing machine you can add clothes at anytime of the running cycle.3. The cleanness of the cloth is super. Bu...READ MORE",4.0,"Jan, 2023",Supriyo Saha,,Thomson 7.5 kg 5 Star Aqua Magic Semi Automatic Top Load Washing Machine Black  (TSA7500SP),,Yes,Flipkart,245.csv
526,FK_20251011_144038_8,Pretty good,Sprb product..🥰READ MORE,4.0,"Apr, 2024",Divya Raja,,Thomson 7.5 kg 5 Star Aqua Magic Semi Automatic Top Load Washing Machine Black  (TSA7500SP),,Yes,Flipkart,245.csv
527,FK_20251011_144038_13,Wonderful,Very nice and beautifulREAD MORE,4.0,"May, 2024",Anshuman  Pathak,,Thomson 7.5 kg 5 Star Aqua Magic Semi Automatic Top Load Washing Machine Black  (TSA7500SP),,Yes,Flipkart,245.csv
528,FK_20251011_141932_5,Wonderful,GoodREAD MORE,4.0,,Shashi Kumar,8 months ago,"GameSir Silver T800 Ultra Smartwatch Stainless Steel, BT Calling, Fitness & Music Smartwatch  (Silve",,Yes,Flipkart,114.csv
529,FK_20251011_141932_4,Wonderful,GoodREAD MORE,4.0,,Shashi Kumar,5 months ago,"GameSir Silver T800 Ultra Smartwatch Stainless Steel, BT Calling, Fitness & Music Smartwatch  (Silve",,Yes,Flipkart,114.csv
530,FK_20251011_134852_8,,4Looking so nice and comfortable product ☺️READ MORE,4.0,,NiHaL GuPtA,4 months ago,"RED TAPE 
Casual Sneaker Shoes for Men | Elegantly Rounded Front, Soothing Insole Sneakers For Men  ",,Yes,Flipkart,47.csv
531,FK_20251011_144615_5,Very Good,Budget friendly Air Conditioner valuable for upto 90 sqftREAD MORE,4.0,,Ranit Sadhukhan,2 months ago,"Panasonic 2025 Model 0.9 Ton 3 Star Split Inverter AC - White  (CS-SU11AKY3T/CU-SU11AKY3T, Copper Co",,Yes,Flipkart,245.csv
532,FK_20251011_144550_6,Delightful,"After use of one week, cooling is very good in very short time and feature is also very good, behave of technician is also nice but major issue with installation charges of materials, company charge me Rs. 9000/- for installtion which is beyond my expectation and not satisfying at all with the same. Company need to see this for future else customer will be very upset like me.READ MORE",4.0,"Jun, 2021",Bijit  Sarswat,,"Samsung 2025 Model Bespoke AI, 5 Step Convertible 1.5 Ton 3 Star Split Inverter with Powerful coolin",,Yes,Flipkart,245.csv
533,FK_20251011_135342_13,Very Good,Superb build quality by HP. Very nice product in this range by HP. Don't go with local brand like zebronics or same else for cheap price as they will end up problem with that just go with brand like HP or Dell as they provide suprb quality for keyboard and mouse in this range.READ MORE,4.0,"Oct, 2023",Gajendra Gaud,,"HP 330 Mouse & Keyboard Combo Wireless Standard Desktop Keyboard Compatible with Desktop, Laptop, Ma",,Yes,Flipkart,70.csv
534,FK_20251011_135342_11,Delightful,"Overall satisfied with the product considering the money spent.Keyboard:Smooth buttonsMouse:Smooth sensitivity,It's actually small. So holding it with the hand is not much comfortable.Mouse wheel is a bit sturdy.READ MORE",4.0,"Sep, 2022",Rajeswaran A,,"HP 330 Mouse & Keyboard Combo Wireless Standard Desktop Keyboard Compatible with Desktop, Laptop, Ma",,Yes,Flipkart,70.csv
535,FK_20251011_141956_3,,,4.0,,,,"Noise Pro 6 1.85'' Amoled Dispay with A Watch Faces & AI Companion Smartwatch  (Ice Blue Strap, Regu",,No,Flipkart,114.csv
536,FK_20251011_141956_2,,,4.0,,,,"Noise Pro 6 1.85'' Amoled Dispay with A Watch Faces & AI Companion Smartwatch  (Ice Blue Strap, Regu",,No,Flipkart,114.csv
537,FK_20251011_141956_1,Perfect product!,Premium watch in this price range. Noise Fit App support is very bad.But watch is very goodREAD MORE,4.0,,Irfan Pathan,7 months ago,"Noise Pro 6 1.85'' Amoled Dispay with A Watch Faces & AI Companion Smartwatch  (Ice Blue Strap, Regu",,Yes,Flipkart,114.csv
538,FK_20251011_144550_8,Delightful,Nice Product with advanced featuresREAD MORE,4.0,"Mar, 2021",Rajkumar Singh,,"Samsung 2025 Model Bespoke AI, 5 Step Convertible 1.5 Ton 3 Star Split Inverter with Powerful coolin",,Yes,Flipkart,245.csv
539,FK_20251011_144550_11,Could be way better,"Outdoor unit Sound very loud and Indoor unit air Flow sound very loud, Cooling not Good, and swing mood any Direction air Flow sound Change, this Sound is very Irritating.READ MORE",4.0,"Oct, 2022",Mrinal Kumar,,"Samsung 2025 Model Bespoke AI, 5 Step Convertible 1.5 Ton 3 Star Split Inverter with Powerful coolin",,Yes,Flipkart,245.csv
540,FK_20251011_144615_9,Really Nice,Nice productREAD MORE,4.0,,Kafeel Ahmed,5 months ago,"Panasonic 2025 Model 0.9 Ton 3 Star Split Inverter AC - White  (CS-SU11AKY3T/CU-SU11AKY3T, Copper Co",,Yes,Flipkart,245.csv
541,FK_20251011_134852_7,,4Quality 👍Look👍Heavy weight 👎READ MORE,4.0,,ROHIT Mehar,3 months ago,"RED TAPE 
Casual Sneaker Shoes for Men | Elegantly Rounded Front, Soothing Insole Sneakers For Men  ",,Yes,Flipkart,47.csv
542,FK_20251011_134852_11,,4Nice product 👌(this price)READ MORE,4.0,,Bedaram Majhi Majhi,25 days ago,"RED TAPE 
Casual Sneaker Shoes for Men | Elegantly Rounded Front, Soothing Insole Sneakers For Men  ",,Yes,Flipkart,47.csv
543,FK_20251011_144615_4,Very Good,Budget friendly Air Conditioner valuable for upto 90 sqftREAD MORE,4.0,,Ranit Sadhukhan,5 months ago,"Panasonic 2025 Model 0.9 Ton 3 Star Split Inverter AC - White  (CS-SU11AKY3T/CU-SU11AKY3T, Copper Co",,Yes,Flipkart,245.csv
544,FK_20251011_145659_10,,,4.0,,,,,,No,Flipkart,149.csv
545,FK_20251011_144550_12,Very Good,Samsung is the best productDon't miss this deal200% by this productIn 10 minutes the room was chilledREAD MORE,4.0,"Jan, 2024",Vijay Sharma,,"Samsung 2025 Model Bespoke AI, 5 Step Convertible 1.5 Ton 3 Star Split Inverter with Powerful coolin",,Yes,Flipkart,245.csv
546,FK_20251011_144615_7,Pretty good,Avi tak goodREAD MORE,4.0,,pinak pani nath,2 months ago,"Panasonic 2025 Model 0.9 Ton 3 Star Split Inverter AC - White  (CS-SU11AKY3T/CU-SU11AKY3T, Copper Co",,Yes,Flipkart,245.csv
547,FK_20251011_134938_12,,4Good 👍READ MORE,4.0,,Santu Kumar,3 months ago,"kardam&sons 
kardam&sons luxury fashionable Stylish Light Weight Sneakers white Sneakers For Men  (W",,Yes,Flipkart,47.csv
548,FK_20251011_135003_1,,4Sole is good as per expectation... But price is little bit high..Under 4k-5k is good.READ MORE,4.0,"Dec, 2023",Dr. Imran Ansari,Flipkart Customer,"PUMA 
TRC Blaze Knit Sneakers For Men  (Black , 6)",,Yes,Flipkart,47.csv
549,FK_20251011_135003_2,,4Sole is good as per expectation... But price is little bit high..Under 4k-5k is good.READ MORE,4.0,"Dec, 2023",Dr. Imran Ansari,Flipkart Customer,"PUMA 
TRC Blaze Knit Sneakers For Men  (Black , 6)",,Yes,Flipkart,47.csv
550,FK_20251011_135003_4,,,4.0,,,,"PUMA 
TRC Blaze Knit Sneakers For Men  (Black , 6)",,No,Flipkart,47.csv
551,FK_20251011_135003_3,,,4.0,,,,"PUMA 
TRC Blaze Knit Sneakers For Men  (Black , 6)",,No,Flipkart,47.csv
552,FK_20251011_135003_5,,,4.0,,,,"PUMA 
TRC Blaze Knit Sneakers For Men  (Black , 6)",,No,Flipkart,47.csv
553,FK_20251011_135003_6,,4Sole is good as per expectation... But price is little bit high..Under 4k-5k is good.READ MORE,4.0,"May, 2024",Dr. Imran Ansari,,"PUMA 
TRC Blaze Knit Sneakers For Men  (Black , 6)",,Yes,Flipkart,47.csv
554,FK_20251011_132431_5,Really Nice,Nice ❤READ MORE,4.0,,Puja Mondal,6 months ago,"Mivi Duopods B1 (Just Launched)45Hrs Playtime, AI ENC for HD Call, Fast Charging, 5.3 Bluetooth  (Bl",,Yes,Flipkart,56.csv
555,FK_20251011_135003_7,,4Everything was perfectREAD MORE,4.0,"Apr, 2024",Flipkart Customer,,"PUMA 
TRC Blaze Knit Sneakers For Men  (Black , 6)",,Yes,Flipkart,47.csv
556,FK_20251011_145613_13,The packaging was bad,The book shape was distortedREAD MORE,4.0,"Feb, 2018",Kiran RP,,"Domain-Driven Design  (English, Hardcover, Evans Eric)",,Yes,Flipkart,149.csv
557,FK_20251011_145637_8,"Book is excellent, the service isn't.",The book content as as expected - amazing! The binding could have been better although.READ MORE,4.0,"Sep, 2024",Ankit Singh,,"Introduction to Algorithms, fourth edition  (English, Hardcover, Cormen Thomas H.)",,Yes,Flipkart,149.csv
558,FK_20251011_134938_8,,4Good productREAD MORE,4.0,,Vishnu Nishad,4 months ago,"kardam&sons 
kardam&sons luxury fashionable Stylish Light Weight Sneakers white Sneakers For Men  (W",,Yes,Flipkart,47.csv
559,FK_20251011_134938_9,,4The quality of these shoes is excellent and they are very comfortable to wear.READ MORE,4.0,,Sk Varma,3 months ago,"kardam&sons 
kardam&sons luxury fashionable Stylish Light Weight Sneakers white Sneakers For Men  (W",,Yes,Flipkart,47.csv
560,FK_20251011_134938_7,,4This product is bestREAD MORE,4.0,,Flipkart Customer,5 months ago,"kardam&sons 
kardam&sons luxury fashionable Stylish Light Weight Sneakers white Sneakers For Men  (W",,Yes,Flipkart,47.csv
561,FK_20251011_134938_6,,4Nice product 👍READ MORE,4.0,,Yogeshkumaryadav Yadav,6 months ago,"kardam&sons 
kardam&sons luxury fashionable Stylish Light Weight Sneakers white Sneakers For Men  (W",,Yes,Flipkart,47.csv
562,FK_20251011_145751_11,Nice product,Guys this is not a paid review.Idk if this book is Original or a copy but the pages are really really good.READ MORE,4.0,,Flipkart Customer,9 months ago,"Cracking the Pm Interview - How to Land a Product Manager Job in Technology  (English, Paperback, Mc",,Yes,Flipkart,149.csv
563,FK_20251011_144503_6,Wonderful,"Good product with no noise, excellent cooling after almost 10 days of usage. Bought 2.5 tonREAD MORE",4.0,"Jun, 2024",Aakash Mishra,,Godrej 2025 Model 5-In-1-Convertible Cooling 2.5 Ton 3 Star Split Inverter With 4 Way Air Swing and ,,Yes,Flipkart,245.csv
564,FK_20251011_145811_10,,,4.0,,,,,,No,Flipkart,149.csv
565,FK_20251011_144440_10,Very Good,Installation services not good other wise products is excellentREAD MORE,4.0,"Jul, 2024",Manish Mehra,,"IFB 2025 Model Silver Plus Series 1.5 Ton 5 Star Split Inverter with HD Compressor, AI, Dual Gold Fi",,Yes,Flipkart,245.csv
566,FK_20251011_145726_7,,,4.0,,,,"Black Hat Python, 2nd Edition  (English, Paperback, Seitz Justin)",,No,Flipkart,149.csv
567,FK_20251011_144440_6,Very Good,Product quality is good and effecient.But flipkar and EKart service is very very poorREAD MORE,4.0,"Apr, 2024",Rupesh Singh,,"IFB 2025 Model Silver Plus Series 1.5 Ton 5 Star Split Inverter with HD Compressor, AI, Dual Gold Fi",,Yes,Flipkart,245.csv
568,FK_20251011_132458_4,Wonderful,Rating according to my own experience :#Don't miss any point please1) Bass : 5/5 (Excellent and extra bass can be added through Realme link app which is available on play store in every phone)2) Sound/Vocals (music) : 5/5 (Clear vocals..every word clear.3) Volume : 5/5 (High volume and volume can be enhanced in Realme link app)4) Touch Control : 4.5/5 (Fast response to touch)5) Realme Link app : 5/5 (Everything can be controled and customized with the help of this app)6) Calling : 4/5 ...READ MORE,4.0,"Sep, 2022",Ravi kumar,Renjith Babu,"realme Buds T200 Lite with 12.4mm Driver, 48hrs Playback, AI ENC & Dual-Device Pairing Bluetooth  (V",,Yes,Flipkart,56.csv
569,FK_20251011_145550_6,Must Have in Your Rack,"The GOF is a very well written book on Design Patterns with examples in C++.It not only explains the need and use of individual patterns but also gives insight on other aspects like usage, limitation, comparison...READ MORE",4.0,"Aug, 2013",Shreyas J,,"Design Patterns  (English, Hardcover, Gamma Erich)",,No,Flipkart,149.csv
570,FK_20251011_144526_6,Value-for-money,"AC is good and cooling is also fast.It doesn't have convertible option but gets converted automatically to reduce power consumption.Important thing to note is that DAIKIN AC of any models doesn't come with power cable from indoor unit to plug point like other AC.The power cable is connected to outdoor unit to plug point,which you have to buy from technician fully,it will require minimum 6 metres and will increase accordingly to the distance between outdoor unit and plug point.READ MORE",4.0,"Mar, 2024",SHAILESH MUDALIAR,,Daikin 2024 Model 1.5 Ton 3 Star Split Inverter AC with PM 2.5 Filter - White  (MTKL50UV16VAF/RKL50U,,Yes,Flipkart,245.csv
571,FK_20251011_144526_5,Really Nice,I bought this FTKY50 series diakin model. I didn't look carefully that it has dual rotary compressor instead of the famous neo swing compressor. Another major thing is that it has only dual display feature instead of tripple display. It doesn't show the compressor running frequency. The operating range of this model is also worse.Carefully select MTKL50 model which has swing compressor and all other advanced features.READ MORE,4.0,"Apr, 2024",Sachet Kumar,,Daikin 2024 Model 1.5 Ton 3 Star Split Inverter AC with PM 2.5 Filter - White  (MTKL50UV16VAF/RKL50U,,Yes,Flipkart,245.csv
572,FK_20251011_144526_4,Really Nice,I bought this FTKY50 series diakin model. I didn't look carefully that it has dual rotary compressor instead of the famous neo swing compressor. Another major thing is that it has only dual display feature instead of tripple display. It doesn't show the compressor running frequency. The operating range of this model is also worse.Carefully select MTKL50 model which has swing compressor and all other advanced features.READ MORE,4.0,"Mar, 2021",Sachet Kumar,Murali Mohan,Daikin 2024 Model 1.5 Ton 3 Star Split Inverter AC with PM 2.5 Filter - White  (MTKL50UV16VAF/RKL50U,,Yes,Flipkart,245.csv
573,FK_20251011_144503_8,Nice product,LikeREAD MORE,4.0,"Apr, 2024",Surajit Barua,,Godrej 2025 Model 5-In-1-Convertible Cooling 2.5 Ton 3 Star Split Inverter With 4 Way Air Swing and ,,Yes,Flipkart,245.csv
574,FK_20251011_144503_7,Nice product,"It's very good value for money product. Also, the service person was very coprative and polite.READ MORE",4.0,,Nupur Gupta,8 months ago,Godrej 2025 Model 5-In-1-Convertible Cooling 2.5 Ton 3 Star Split Inverter With 4 Way Air Swing and ,,Yes,Flipkart,245.csv
575,FK_20251011_145550_13,Very good book to get your head around design patterns,"This book is very good to understand design patterns. As the book goes on, it loosely lays out the design for a complex software, chapter by chapter as it nears completion. Different components of the software is constructed (planned out) using different patterns, so the user can get an idea straight away regarding implementation of the said pattern, its pros and cons.In my opinion, this book is best read in a hyper-linked fashion, by reading up the chapters on the particular pattern as it ...READ MORE",4.0,"Sep, 2012",Avik Chatterjee,,"Design Patterns  (English, Hardcover, Gamma Erich)",,Yes,Flipkart,149.csv
576,FK_20251011_145550_11,It was good,This book is one of the best books to read. If you are OOP developer you must go through this book.The courier was well packed. Good Experience with the Flipkart. I am going to shop more on flipkart.READ MORE,4.0,"Jun, 2012",Shivaprakash Hurukadli,,"Design Patterns  (English, Hardcover, Gamma Erich)",,Yes,Flipkart,149.csv
577,FK_20251011_134938_11,,4Value for money 🥰🥰READ MORE,4.0,,Harsh Tadvi,5 months ago,"kardam&sons 
kardam&sons luxury fashionable Stylish Light Weight Sneakers white Sneakers For Men  (W",,Yes,Flipkart,47.csv
578,FK_20251011_145550_8,In depth knowledge of design patterns,It is a great book to get complete idea and implementation details of design patterns. All design patterns are explained very well and specially their comparison at the end. One thing I didn't like is that examples they have given are in smalltalk may be they could have given it in C# or JAVAREAD MORE,4.0,"Jan, 2012",Nikhil  Ketkar,,"Design Patterns  (English, Hardcover, Gamma Erich)",,Yes,Flipkart,149.csv
579,FK_20251011_132431_4,Really Nice,Nice ❤READ MORE,4.0,Mayur Pratap  Singh,Puja Mondal,6 months ago,"Mivi Duopods B1 (Just Launched)45Hrs Playtime, AI ENC for HD Call, Fast Charging, 5.3 Bluetooth  (Bl",,Yes,Flipkart,56.csv
580,FK_20251011_135003_12,,4Very good productREAD MORE,4.0,"May, 2024",Vaibhav Dixit,,"PUMA 
TRC Blaze Knit Sneakers For Men  (Black , 6)",,Yes,Flipkart,47.csv
581,FK_20251011_135003_14,,4Very goodREAD MORE,4.0,"Apr, 2024",Flipkart Customer,,"PUMA 
TRC Blaze Knit Sneakers For Men  (Black , 6)",,Yes,Flipkart,47.csv
582,FK_20251011_144550_4,Good choice,"> 3 Star Power Rating,> ISEER 3.65, Lable Period June 2015 To Dec 2017,> Digital Inverter Technology & BLDC 8 Pole Motor for Compressor,> Anti Corrosion Coating By Durafin on Condenser,> Aluminium Condenser,> Free 3 Meter Copper Pipe And 4 x Rubber Legs For Compressor in Package,> Cooling Only, Heat Mode Not Available,> No Drain Pipe in Package,> No Power Cable to Connect Indoor and Outdoor Units in Package,> 5 Year Warranty on Durafin Condenser> 10 Year Warranty on ...READ MORE",4.0,"Mar, 2020",Parimal Ajudiya,Gunjan Patel,"Samsung 2025 Model Bespoke AI, 5 Step Convertible 1.5 Ton 3 Star Split Inverter with Powerful coolin",,Yes,Flipkart,245.csv
583,FK_20251011_144526_12,Good quality product,"There is no doubt about Daikin AC performance and delivery service of Flipkart. However, installation agecy assigned by Flipkart (M/s.Jeeves) is worse in it's professionalism. They were neither on schedule date and nor were they polite towards their customers. I hv read similar complaint despite that I hv purchased AC through Flipkart but unfortunately experience the same poor service by it's installation agency. I would recommend not to opt for installation from Flipkart as it is very costly...READ MORE",4.0,"Apr, 2019",Akshay Tichkule,,Daikin 2024 Model 1.5 Ton 3 Star Split Inverter AC with PM 2.5 Filter - White  (MTKL50UV16VAF/RKL50U,,Yes,Flipkart,245.csv
584,FK_20251011_144526_7,Nice product,SuperREAD MORE,4.0,"Mar, 2020",M Gulshan Ahamad  Baig,,Daikin 2024 Model 1.5 Ton 3 Star Split Inverter AC with PM 2.5 Filter - White  (MTKL50UV16VAF/RKL50U,,Yes,Flipkart,245.csv
585,FK_20251011_144550_5,Good choice,"> 3 Star Power Rating,> ISEER 3.65, Lable Period June 2015 To Dec 2017,> Digital Inverter Technology & BLDC 8 Pole Motor for Compressor,> Anti Corrosion Coating By Durafin on Condenser,> Aluminium Condenser,> Free 3 Meter Copper Pipe And 4 x Rubber Legs For Compressor in Package,> Cooling Only, Heat Mode Not Available,> No Drain Pipe in Package,> No Power Cable to Connect Indoor and Outdoor Units in Package,> 5 Year Warranty on Durafin Condenser> 10 Year Warranty on ...READ MORE",4.0,"Mar, 2017",Parimal Ajudiya,,"Samsung 2025 Model Bespoke AI, 5 Step Convertible 1.5 Ton 3 Star Split Inverter with Powerful coolin",,Yes,Flipkart,245.csv
586,FK_20251011_145550_9,best book ever.........,"this is best book the people who r intrested in computer programing, and are starting as a new user. this books really is a great advantage for the new comer in this feild. now its up to you what u wanna do with this oppurtunity to purchase this book at such a low cost,,,,,,,but as far as y review is coserned i will advise to u purchase book with no restrains iin the mindREAD MORE",4.0,"Dec, 2011",arpit shah,,"Design Patterns  (English, Hardcover, Gamma Erich)",,No,Flipkart,149.csv
587,FK_20251011_142534_9,Value-for-money,Everything is good no problem you can buy this tv without any hesitation! But there should be an option like wall mount or table stand whatever you can purchase because tv installation take 4k to meREAD MORE,4.0,,Abdul Qadir,1 month ago,TCL T89C 139 cm (55 inch) QLED Ultra HD (4K) Smart Google TV 2025 Edition with HVA Panel | Dolby Vis,,Yes,Flipkart,57.csv
588,FK_20251011_142534_8,Worth the money,"Purchased recently 2..3 days ago ..it is very good so far in terms of clarity , motion images and contents, refresh rate etc. sound is also good , but can be bit better in voice clarity due to sub woofer have lil bit of bass effect but voice is getting pushed downREAD MORE",4.0,,Gaurav Jagtap,2 months ago,TCL T89C 139 cm (55 inch) QLED Ultra HD (4K) Smart Google TV 2025 Edition with HVA Panel | Dolby Vis,,Yes,Flipkart,57.csv
589,FK_20251011_142534_7,Really Nice,Sound and picture bothREAD MORE,4.0,,Debajyoti Sahoo,3 months ago,TCL T89C 139 cm (55 inch) QLED Ultra HD (4K) Smart Google TV 2025 Edition with HVA Panel | Dolby Vis,,Yes,Flipkart,57.csv
590,FK_20251011_142534_6,Pretty good,1. The picture quality is top notch. 5/52. The sound quality is adequate and you don't need additional speakers and you don't even have to go beyond 18-24 in volume while fan running 4.5/53. Boot time is around 15-20 seconds4. Works fine without major lag issue5. Hdr10 support with Dolby Atmos is good6. Apple air support is also adequate.Got it for 31k after card discount in BBD sale good to go tv if you get it under 35-36k for 55'inchOverall good product. But beware of installation a...READ MORE,4.0,,Akash Solanki,7 days ago,TCL T89C 139 cm (55 inch) QLED Ultra HD (4K) Smart Google TV 2025 Edition with HVA Panel | Dolby Vis,,Yes,Flipkart,57.csv
591,FK_20251011_144224_14,Value-for-money,"Writing this review after almost 1 month of use,Pros,Performance - Best, doing the job wellSize and Color - True As shown in the picturesWater and electricity - Moderate consumptionCons,Water outlet pipe is provided on the back side which is causing the machine to keep at a certain distance from the wall, that consumes extra space, also it is risky if the machine gets pushed towards the wall or while movingREAD MORE",4.0,"Jun, 2023",Swapnil Girkar,,Whirlpool 10 kg Ace XL Semi Automatic Top Load Washing Machine Grey  (MAGIC CLEAN 10 DMIX GREY DAZZL,,Yes,Flipkart,245.csv
592,FK_20251011_142600_14,Pretty good,Overall goodREAD MORE,4.0,,Flipkart Customer,3 months ago,iFFALCON by TCL U65 138 cm (55 inch) Ultra HD (4K) LED Smart Google TV 2025 Edition with MEMC | Dolb,,Yes,Flipkart,57.csv
593,FK_20251011_134619_6,,4Good quality 👍READ MORE,4.0,"Sep, 2022",Flipkart Customer,,"HOTSTYLE 
Trendy & Stylish Loafers For Men  (Black , 7)",,Yes,Flipkart,15.csv
594,FK_20251011_142534_1,Fabulous!,It's really good qled tv... Picture quality is superb... Little bit sad with delivery and installation time...READ MORE,4.0,Janak Patel,Chandan Kumar Singh,3 months ago,TCL T89C 139 cm (55 inch) QLED Ultra HD (4K) Smart Google TV 2025 Edition with HVA Panel | Dolby Vis,,Yes,Flipkart,57.csv
595,FK_20251011_142534_2,,,4.0,,,,TCL T89C 139 cm (55 inch) QLED Ultra HD (4K) Smart Google TV 2025 Edition with HVA Panel | Dolby Vis,,No,Flipkart,57.csv
596,FK_20251011_142534_3,,,4.0,,,,TCL T89C 139 cm (55 inch) QLED Ultra HD (4K) Smart Google TV 2025 Edition with HVA Panel | Dolby Vis,,No,Flipkart,57.csv
597,FK_20251011_144350_5,Good choice,"Honestly speaking, the AC is too good at this price segment. Overall performance is best. It takes less time to cool and it also operates in silent manner. The 6-in-1 feature is just like fire🔥. This variant has no WIFI facility and the display of the remote has no light. It may be difficult to operate the remote in night when all the lights of the room are off. Overall, I am happy with this product after 30 days usingBut I am not satisfied with the installation work from Jeeves company. F...READ MORE",4.0,"May, 2024",SUBHA  MANDAL,,LG 2025 Model AI Convertible 6-in-1 Split 1.5 Ton 5 Star Split AI Dual Inverter with Faster Cooling ,,Yes,Flipkart,245.csv
598,FK_20251011_144319_10,Very Good,Honest review after one month of use.Design is very nice. Less sound. Drying capacity is very fabulous as dryer motor is very good. But clothes getting struck while washing resulting in tearing and it is very bad in this W/machine.READ MORE,4.0,"Jan, 2023",Ravi  Kumar,,"Whirlpool 7 kg 5 Star with Ace Wash Station, 1400 RPM Speed and Rust Proof Semi Automatic Top Load W",,Yes,Flipkart,245.csv
599,FK_20251011_144319_8,Good choice,"Hey guys, I've been using Whirlpool washing machines for about 7-8 years now. Recently I purchased this new model, and I must say, it's a major upgrade from the old semi-automatic one. The performance is top-notch, and the build quality is solid. Totally recommend it! 👍READ MORE",4.0,"Nov, 2023",Aman Alam,,"Whirlpool 7 kg 5 Star with Ace Wash Station, 1400 RPM Speed and Rust Proof Semi Automatic Top Load W",,Yes,Flipkart,245.csv
