SNo,Review_ID,Review_Title,Review_Text,Rating,Date_Time,Reviewer_Name,Location,Product_Name,Category,Verified_Purchase,Site,Source_File
301,FK_20251011_143925_14,Worth every penny,The best tab under this price range. Just go for it without any confusion...READ MORE,5.0,"Aug, 2023",shaik abrar,,realme Pad 2 6 GB RAM 128 GB ROM 11.5 inch with 4G Tablet (Inspiration Green),,Yes,Flipkart,245.csv
302,FK_20251011_143925_13,Super!,A lovely tabletFor students it's bestCamera is good from the perspective of tabletPerformance is very smooth 💪Sound quality is awesome 💯Overall features are good as per this price because you will not get everything in just this much .READ MORE,5.0,"Aug, 2023",Himanshu  Sharma,,realme Pad 2 6 GB RAM 128 GB ROM 11.5 inch with 4G Tablet (Inspiration Green),,Yes,Flipkart,245.csv
303,FK_20251011_144129_6,Awesome,"Good product, 5 star electricity rating it consumes low electricity, 3 washing modes work fantastic, Drying part is also awesome only 2 minutes the clothes getting dry. LG means Life's GoodREAD MORE",5.0,"Aug, 2022",Md Asif Parwez,,"LG 7 kg 5 Star with Wind Jet Dry, Collar Scrubber and Rust Free Plastic Base Semi Automatic Top Load",,Yes,Flipkart,245.csv
304,FK_20251011_144103_14,Awesome,Seller sent me awesome 😎 product Most reliable washing machine brand for LG thank you.flipcart and delevery experience is so good product is so nice 🙂READ MORE,5.0,"May, 2022",Durga  Gupta,,"LG 7 kg 5 Star with Wind Jet Dry, Collar Scrubber and Rust Free Plastic Base Semi Automatic Top Load",,Yes,Flipkart,245.csv
305,FK_20251011_144103_13,Best in the market!,Awesome ❤️READ MORE,5.0,"Oct, 2021",Archana Maurya,,"LG 7 kg 5 Star with Wind Jet Dry, Collar Scrubber and Rust Free Plastic Base Semi Automatic Top Load",,Yes,Flipkart,245.csv
306,FK_20251011_144103_9,Must buy!,Perfect 💖😊💖READ MORE,5.0,"May, 2022",NARESH Soni,,"LG 7 kg 5 Star with Wind Jet Dry, Collar Scrubber and Rust Free Plastic Base Semi Automatic Top Load",,Yes,Flipkart,245.csv
307,FK_20251011_144103_8,Classy product,"Awesome product and nice service delivery support by Flipkart, Thanks!READ MORE",5.0,"Mar, 2022",Amit Shikare,,"LG 7 kg 5 Star with Wind Jet Dry, Collar Scrubber and Rust Free Plastic Base Semi Automatic Top Load",,Yes,Flipkart,245.csv
308,FK_20251011_144103_7,Must buy!,Best one 👍 go for itREAD MORE,5.0,"Jun, 2022",Samparna Pattanayak,,"LG 7 kg 5 Star with Wind Jet Dry, Collar Scrubber and Rust Free Plastic Base Semi Automatic Top Load",,Yes,Flipkart,245.csv
309,FK_20251011_144103_6,Awesome,"Good product, 5 star electricity rating it consumes low electricity, 3 washing modes work fantastic, Drying part is also awesome only 2 minutes the clothes getting dry. LG means Life's GoodREAD MORE",5.0,"Aug, 2022",Md Asif Parwez,,"LG 7 kg 5 Star with Wind Jet Dry, Collar Scrubber and Rust Free Plastic Base Semi Automatic Top Load",,Yes,Flipkart,245.csv
310,FK_20251011_144013_14,Worth every penny,The best tab under this price range. Just go for it without any confusion...READ MORE,5.0,"Aug, 2023",shaik abrar,,realme Pad 2 8 GB RAM 256 GB ROM 11.5 inch with 4G Tablet (Inspiration Green),,Yes,Flipkart,245.csv
311,FK_20251011_144013_13,Super!,A lovely tabletFor students it's bestCamera is good from the perspective of tabletPerformance is very smooth 💪Sound quality is awesome 💯Overall features are good as per this price because you will not get everything in just this much .READ MORE,5.0,"Aug, 2023",Himanshu  Sharma,,realme Pad 2 8 GB RAM 256 GB ROM 11.5 inch with 4G Tablet (Inspiration Green),,Yes,Flipkart,245.csv
312,FK_20251011_144013_12,Brilliant,Realme pad 2 quality amezing and nice look I'm happy this order 👍👍👍👍READ MORE,5.0,"Aug, 2023",Siyaram Giri,,realme Pad 2 8 GB RAM 256 GB ROM 11.5 inch with 4G Tablet (Inspiration Green),,Yes,Flipkart,245.csv
313,FK_20251011_144013_11,Terrific purchase,TRADERS Go for it...🔥🔥READ MORE,5.0,"Sep, 2023",Siddharth Kapare,,realme Pad 2 8 GB RAM 256 GB ROM 11.5 inch with 4G Tablet (Inspiration Green),,Yes,Flipkart,245.csv
314,FK_20251011_144013_10,Brilliant,Nice product realme is always bestREAD MORE,5.0,"Aug, 2023",Vishal Singh,,realme Pad 2 8 GB RAM 256 GB ROM 11.5 inch with 4G Tablet (Inspiration Green),,Yes,Flipkart,245.csv
315,FK_20251011_144013_9,Great product,Best for students and medicos'READ MORE,5.0,"Sep, 2023",Arunava  Pramanik,,realme Pad 2 8 GB RAM 256 GB ROM 11.5 inch with 4G Tablet (Inspiration Green),,Yes,Flipkart,245.csv
316,FK_20251011_144013_8,Wonderful,Best for trading 🔥READ MORE,5.0,"Feb, 2024",vineet,,realme Pad 2 8 GB RAM 256 GB ROM 11.5 inch with 4G Tablet (Inspiration Green),,Yes,Flipkart,245.csv
317,FK_20251011_144013_7,Awesome,Best for trading stocks marketREAD MORE,5.0,"Sep, 2023",Yash Pawar,,realme Pad 2 8 GB RAM 256 GB ROM 11.5 inch with 4G Tablet (Inspiration Green),,Yes,Flipkart,245.csv
318,FK_20251011_144013_6,Super!,Awesome ProductCamera .... Ok okBattery ... awesomeScreen ... Also goodOverall Value for moneyRecommended to buyREAD MORE,5.0,"Nov, 2023",Jai Madaan,,realme Pad 2 8 GB RAM 256 GB ROM 11.5 inch with 4G Tablet (Inspiration Green),,Yes,Flipkart,245.csv
319,FK_20251011_144013_5,Just wow! but not for student.,"It's a 1 month review about this product.Battry and Charging:-Using online class 9 hours per day and its still remain 10-15% charging percent.Best and battery and charging.Screen quality is also good.only missing thing is, it should be support realme pen.or everything is okay.who wants it to buy for normal purpose go and buy. but if you are a student and this doesn't provide notes making solution or realme pen for student its not good. in today's era every student sh...READ MORE",5.0,"Sep, 2023",Praveen Prabhakar,,realme Pad 2 8 GB RAM 256 GB ROM 11.5 inch with 4G Tablet (Inspiration Green),,Yes,Flipkart,245.csv
320,FK_20251011_144013_4,Just wow! but not for student.,"It's a 1 month review about this product.Battry and Charging:-Using online class 9 hours per day and its still remain 10-15% charging percent.Best and battery and charging.Screen quality is also good.only missing thing is, it should be support realme pen.or everything is okay.who wants it to buy for normal purpose go and buy. but if you are a student and this doesn't provide notes making solution or realme pen for student its not good. in today's era every student sh...READ MORE",5.0,"Aug, 2023",Praveen Prabhakar,shaik abrar,realme Pad 2 8 GB RAM 256 GB ROM 11.5 inch with 4G Tablet (Inspiration Green),,Yes,Flipkart,245.csv
321,FK_20251011_144038_14,Great product,Well performanceREAD MORE,5.0,"Oct, 2022",RAVI RAJ KUMAR,,Thomson 7.5 kg 5 Star Aqua Magic Semi Automatic Top Load Washing Machine Black  (TSA7500SP),,Yes,Flipkart,245.csv
322,FK_20251011_144038_12,Excellent,SuperREAD MORE,5.0,"Jun, 2023",Sakthi  Raj,,Thomson 7.5 kg 5 Star Aqua Magic Semi Automatic Top Load Washing Machine Black  (TSA7500SP),,Yes,Flipkart,245.csv
323,FK_20251011_144038_11,Classy product,Premium Quality..👌READ MORE,5.0,"Sep, 2022",Sudarshan Suresh Poojari,,Thomson 7.5 kg 5 Star Aqua Magic Semi Automatic Top Load Washing Machine Black  (TSA7500SP),,Yes,Flipkart,245.csv
324,FK_20251011_144038_10,Simply awesome,Awesome product Thank you Flipkart.READ MORE,5.0,"Jul, 2023",Md Quamar Danish,,Thomson 7.5 kg 5 Star Aqua Magic Semi Automatic Top Load Washing Machine Black  (TSA7500SP),,Yes,Flipkart,245.csv
325,FK_20251011_144038_9,Simply awesome,Average plastic quality but product n getup is very good..READ MORE,5.0,"Oct, 2022",Bappa Ghosh,,Thomson 7.5 kg 5 Star Aqua Magic Semi Automatic Top Load Washing Machine Black  (TSA7500SP),,Yes,Flipkart,245.csv
326,FK_20251011_135433_12,Brilliant,The price was Great Quality ......Easy to connectPlug and use ....But only one thing i didn't likeThat was  Mouse Need One AA size battaryAndKeyboards need two AAA size batteries....Batteries not included in boxREAD MORE,5.0,"May, 2022",Subhasis Deepika,,Portronics POR-1569 Combo Set  (Grey),,Yes,Flipkart,70.csv
327,FK_20251011_135433_11,Awesome,Good qualityREAD MORE,5.0,"Apr, 2022",Monu  Kumar,,Portronics POR-1569 Combo Set  (Grey),,Yes,Flipkart,70.csv
328,FK_20251011_135433_10,Best in the market!,"Awesome purchase at awesome price.Patronics never disappoints you.This js my second purchase .1st purchase is more than a year old & now hope this one also don't disappoints.Go for it Looks is classy .red colour looks adorable..Works wise you'll will not be disappointed.Highly recommend.update after 3 months of use - Mouse stopped working.Asked for warranty claim from Patronics,they asked me to send the package then try will analyse itREAD MORE",5.0,"Jan, 2022",ABHINAV  VERMA,,Portronics POR-1569 Combo Set  (Grey),,Yes,Flipkart,70.csv
329,FK_20251011_135433_9,Terrific,The buttons are quite soft and sound of the buttons are pretty good. And for sure keyboard have a good design. Coming on to Mouse it has a good look the scroll button is hard to press as compared with others mouses but it is reliable and handy.The size of mouse is good. Every single penny is worth it. I would recommend you guys to purchase this productREAD MORE,5.0,"Jun, 2022",S K MOMIN ALI,,Portronics POR-1569 Combo Set  (Grey),,Yes,Flipkart,70.csv
330,FK_20251011_135433_8,Just wow!,Nice product .... Tx Flipkart .....READ MORE,5.0,"Mar, 2023",Sayal Mandal,,Portronics POR-1569 Combo Set  (Grey),,Yes,Flipkart,70.csv
331,FK_20251011_135433_7,Super!,Nice product for give Flipkart so goodREAD MORE,5.0,"Jan, 2022",Janardan pal,,Portronics POR-1569 Combo Set  (Grey),,Yes,Flipkart,70.csv
332,FK_20251011_135433_6,Super!,"Grey & Black EditionPros• Plastic Looks Premium• Keys are well spaced• Mouse is also looks cool• Num Caps Lock Indicator & also a Battery IndicatorCons• Build Quality is Decent not that much good, Overall I will Recommend If you are a BeginnerREAD MORE",5.0,"Apr, 2022",Yash Lohar,,Portronics POR-1569 Combo Set  (Grey),,Yes,Flipkart,70.csv
333,FK_20251011_135407_14,Awesome,very nice keyboardREAD MORE,5.0,"Sep, 2018",Amit Maurya,,"DELL KB216 Multimedia Keyboard with USB Interface, Plunger Keys Technology & Chiclet Wired USB Stand",,Yes,Flipkart,70.csv
334,FK_20251011_135407_13,Terrific,I am using the same one from last 1 year and its the best one so I purchased another one for my home use.Dell is offering the best keyboard in this price range.Go for it with the best brand #DellREAD MORE,5.0,"Jun, 2020",Deepak Jain,,"DELL KB216 Multimedia Keyboard with USB Interface, Plunger Keys Technology & Chiclet Wired USB Stand",,Yes,Flipkart,70.csv
335,FK_20251011_135407_12,No Words...Just Buy It ! You Won't Regret It !,Superb Product...just loved the slim build and the Dell originality...Awesome Keyboard for all Laptop / PC users...so much user-friendly with delicate keys...Overall had a good transaction / buying experience with Flipkart & the service.Got it in just after 1 day from Order date :-)I would definitely recommend this product to buyers who seek external keyboards online !!READ MORE,5.0,"Oct, 2018",RAJA BASUMATARY,,"DELL KB216 Multimedia Keyboard with USB Interface, Plunger Keys Technology & Chiclet Wired USB Stand",,Yes,Flipkart,70.csv
336,FK_20251011_141906_14,Wonderful,Good 👍READ MORE,5.0,"May, 2023",Jignesh Vala,,"Fire-Boltt Ninja Calling Pro Plus 46.5mm (1.83) Display Bluetooth Calling, AI Voice Smartwatch  (Sil",,Yes,Flipkart,114.csv
337,FK_20251011_141906_13,Terrific purchase,Awesom qualityRubber is expensive all over design greatBattry run 8 days without callingFast charging 😍(.) (.) =( . ) ( . ) 😅🤪READ MORE,5.0,"Mar, 2023",shahzain  Ansari,,"Fire-Boltt Ninja Calling Pro Plus 46.5mm (1.83) Display Bluetooth Calling, AI Voice Smartwatch  (Sil",,Yes,Flipkart,114.csv
338,FK_20251011_141906_12,Best in the market!,Wow NiceREAD MORE,5.0,"Feb, 2023",Flipkart Customer,,"Fire-Boltt Ninja Calling Pro Plus 46.5mm (1.83) Display Bluetooth Calling, AI Voice Smartwatch  (Sil",,Yes,Flipkart,114.csv
339,FK_20251011_141906_11,Worth every penny,Nice looking watch. I love it.READ MORE,5.0,"Feb, 2023",Abinash tripathy,,"Fire-Boltt Ninja Calling Pro Plus 46.5mm (1.83) Display Bluetooth Calling, AI Voice Smartwatch  (Sil",,Yes,Flipkart,114.csv
340,FK_20251011_141906_10,Brilliant,Good qualityREAD MORE,5.0,"Jan, 2023",Raju kumar  Singh,,"Fire-Boltt Ninja Calling Pro Plus 46.5mm (1.83) Display Bluetooth Calling, AI Voice Smartwatch  (Sil",,Yes,Flipkart,114.csv
341,FK_20251011_141906_9,Must buy!,This watch is so preety I love it❤️👌👌READ MORE,5.0,"Jun, 2023",Flipkart Customer,,"Fire-Boltt Ninja Calling Pro Plus 46.5mm (1.83) Display Bluetooth Calling, AI Voice Smartwatch  (Sil",,Yes,Flipkart,114.csv
342,FK_20251011_141906_8,Simply awesome,It's so useful 😍go for it guyes🎉 amazing watch ❣️there are lots off features also speaker it too good also 1 year warrenty card available ❣️😘READ MORE,5.0,"Jan, 2023",Sumit Jaiswal,,"Fire-Boltt Ninja Calling Pro Plus 46.5mm (1.83) Display Bluetooth Calling, AI Voice Smartwatch  (Sil",,Yes,Flipkart,114.csv
343,FK_20251011_141906_7,Classy product,It's a very good for me very usefulREAD MORE,5.0,"Apr, 2023",Sonu Neelon,,"Fire-Boltt Ninja Calling Pro Plus 46.5mm (1.83) Display Bluetooth Calling, AI Voice Smartwatch  (Sil",,Yes,Flipkart,114.csv
344,FK_20251011_145832_1,Great product,Loved itREAD MORE,4.8,,Vikram Yadav,8 months ago,"E-Myth Revisited  (English, Paperback, Gerber Michael E.)",,Yes,Flipkart,149.csv
345,FK_20251011_145832_4,,,4.8,,,,"E-Myth Revisited  (English, Paperback, Gerber Michael E.)",,No,Flipkart,149.csv
346,FK_20251011_145659_8,,,4.8,,,,,,No,Flipkart,149.csv
347,FK_20251011_145832_2,,4.819 Ratings&3 Reviews,4.8,,,,"E-Myth Revisited  (English, Paperback, Gerber Michael E.)",,No,Flipkart,149.csv
348,FK_20251011_145851_4,,,4.8,,,,"Supercharged Coding with GenAI  (English, Paperback, Herszfang Hila Paz)",,No,Flipkart,149.csv
349,FK_20251011_145811_8,,,4.8,,,,,,No,Flipkart,149.csv
350,FK_20251011_145811_7,,,4.6,,,,,,No,Flipkart,149.csv
351,FK_20251011_145637_2,,,4.6,,,,"Introduction to Algorithms, fourth edition  (English, Hardcover, Cormen Thomas H.)",,No,Flipkart,149.csv
352,FK_20251011_145637_1,Classy product,Book is really good and the quality of this is very good.READ MORE,4.6,"Oct, 2023",Pavan  T S,Flipkart Customer,"Introduction to Algorithms, fourth edition  (English, Hardcover, Cormen Thomas H.)",,Yes,Flipkart,149.csv
353,FK_20251011_145637_3,,,4.6,,,,"Introduction to Algorithms, fourth edition  (English, Hardcover, Cormen Thomas H.)",,No,Flipkart,149.csv
354,FK_20251011_145726_8,,,4.6,,,,"Black Hat Python, 2nd Edition  (English, Paperback, Seitz Justin)",,No,Flipkart,149.csv
355,FK_20251011_145659_7,,,4.6,,,,,,No,Flipkart,149.csv
356,FK_20251011_144129_3,,,4.5,,,,"LG 7 kg 5 Star with Wind Jet Dry, Collar Scrubber and Rust Free Plastic Base Semi Automatic Top Load",,No,Flipkart,245.csv
357,FK_20251011_144129_1,Delightful,Everything is good. Performance speed is good design is also good buzzer also works good. Only thing that wash cover should be fixed.READ MORE,4.5,"May, 2022",Harry  Kaler,Durga  Gupta,"LG 7 kg 5 Star with Wind Jet Dry, Collar Scrubber and Rust Free Plastic Base Semi Automatic Top Load",,Yes,Flipkart,245.csv
358,FK_20251011_144129_2,,,4.5,,,,"LG 7 kg 5 Star with Wind Jet Dry, Collar Scrubber and Rust Free Plastic Base Semi Automatic Top Load",,No,Flipkart,245.csv
359,FK_20251011_145659_11,The Definitive Book on Product Management Interviews and Preparation,"This book is marketed as being useful for those preparing for PM interviews in software product companies, but it goes further than that.It provides useful...Read full review",4.5,"Sep, 2019",Ankush Saxena,7 months ago,,,Yes,Flipkart,149.csv
360,FK_20251011_145658_2,,,4.5,,,,,,No,Flipkart,149.csv
361,FK_20251011_145659_9,,,4.5,,,,,,No,Flipkart,149.csv
362,FK_20251011_144103_1,Delightful,Everything is good. Performance speed is good design is also good buzzer also works good. Only thing that wash cover should be fixed.READ MORE,4.5,"May, 2022",Harry  Kaler,Durga  Gupta,"LG 7 kg 5 Star with Wind Jet Dry, Collar Scrubber and Rust Free Plastic Base Semi Automatic Top Load",,Yes,Flipkart,245.csv
363,FK_20251011_145658_3,,,4.5,,,,,,No,Flipkart,149.csv
364,FK_20251011_142019_1,Highly recommended,Nice design with awesome features..Loving it😍😍READ MORE,4.5,"Oct, 2022",Rajeev Kumar,Arsh Deep,"Apple Watch Series 8, 41mm GPS + Cellular ECG app, Temperature sensor, Crash Detection  (Midnight St",,Yes,Flipkart,114.csv
365,FK_20251011_145440_4,,,4.5,,,,"Software Engineering, 10/e  (English, Paperback, Sommerville Ian)",,No,Flipkart,149.csv
366,FK_20251011_145440_7,,,4.5,,,,"Software Engineering, 10/e  (English, Paperback, Sommerville Ian)",,No,Flipkart,149.csv
367,FK_20251011_145811_2,,,4.5,,,,,,No,Flipkart,149.csv
368,FK_20251011_145751_2,,,4.5,,,,"Cracking the Pm Interview - How to Land a Product Manager Job in Technology  (English, Paperback, Mc",,No,Flipkart,149.csv
369,FK_20251011_145811_9,,,4.5,,,,,,No,Flipkart,149.csv
370,FK_20251011_145751_1,The Definitive Book on Product Management Interviews and Preparation,"This book is marketed as being useful for those preparing for PM interviews in software product companies, but it goes further than that.It provides useful, detailed tips on how to be a better product manager, how to prepare for PM interviews of specific companies like Google, Dropbox, Yahoo and how to move into a PM role from different roles and positions in the software product industry.It's an excellent book and a weekend with this is sure to remove many of your misconceptions (it cert...READ MORE",4.5,"May, 2022",Ankush Saxena,Sai Suraj Gadey,"Cracking the Pm Interview - How to Land a Product Manager Job in Technology  (English, Paperback, Mc",,Yes,Flipkart,149.csv
371,FK_20251011_145440_1,Excellent,This Book Is So osowm And Very good productREAD MORE,4.5,"Sep, 2020",Jagabandhu Mohanta,Manish  Yadav,"Software Engineering, 10/e  (English, Paperback, Sommerville Ian)",,Yes,Flipkart,149.csv
372,FK_20251011_145751_3,,,4.5,,,,"Cracking the Pm Interview - How to Land a Product Manager Job in Technology  (English, Paperback, Mc",,No,Flipkart,149.csv
373,FK_20251011_145811_11,The Definitive Book on Product Management Interviews and Preparation,"This book is marketed as being useful for those preparing for PM interviews in software product companies, but it goes further than that.It provides useful...Read full review",4.5,"Sep, 2019",Ankush Saxena,7 months ago,,,Yes,Flipkart,149.csv
374,FK_20251011_145440_2,,4.561 Ratings&3 Reviews,4.5,,,,"Software Engineering, 10/e  (English, Paperback, Sommerville Ian)",,No,Flipkart,149.csv
375,FK_20251011_145355_1,Fabulous!,This book is mainly for BCA. But everyone can study this book who wants to learn c++. I uploaded contents of this book. See picsREAD MORE,4.5,"Oct, 2021",Arsalan Iqbal,Pranav Naiknaware,"Object Oriented Programming with C++ | 8th Edition, E.Balagurusamy  (English, Paperback, E Balagurus",,Yes,Flipkart,149.csv
376,FK_20251011_145811_3,,,4.5,,,,,,No,Flipkart,149.csv
377,FK_20251011_145355_3,,,4.5,,,,"Object Oriented Programming with C++ | 8th Edition, E.Balagurusamy  (English, Paperback, E Balagurus",,No,Flipkart,149.csv
378,FK_20251011_145355_2,,,4.5,,,,"Object Oriented Programming with C++ | 8th Edition, E.Balagurusamy  (English, Paperback, E Balagurus",,No,Flipkart,149.csv
379,FK_20251011_144155_2,,,4.5,,,,"LG Electronics 10.5 kg Semi Automatic Top Load Washing Machine Maroon, White  (P105ASRAZ)",,No,Flipkart,245.csv
380,FK_20251011_144155_1,Wonderful,Nice productREAD MORE,4.5,"Oct, 2024",Karunendra Kumar,Ramakrishna Kesavarapu,"LG Electronics 10.5 kg Semi Automatic Top Load Washing Machine Maroon, White  (P105ASRAZ)",,Yes,Flipkart,245.csv
381,FK_20251011_144103_3,,,4.5,,,,"LG 7 kg 5 Star with Wind Jet Dry, Collar Scrubber and Rust Free Plastic Base Semi Automatic Top Load",,No,Flipkart,245.csv
382,FK_20251011_144103_2,,,4.5,,,,"LG 7 kg 5 Star with Wind Jet Dry, Collar Scrubber and Rust Free Plastic Base Semi Automatic Top Load",,No,Flipkart,245.csv
383,FK_20251011_145832_8,,,4.5,,,,"E-Myth Revisited  (English, Paperback, Gerber Michael E.)",,No,Flipkart,149.csv
384,FK_20251011_144155_3,,,4.5,,,,"LG Electronics 10.5 kg Semi Automatic Top Load Washing Machine Maroon, White  (P105ASRAZ)",,No,Flipkart,245.csv
385,FK_20251011_142019_2,,,4.5,,,,"Apple Watch Series 8, 41mm GPS + Cellular ECG app, Temperature sensor, Crash Detection  (Midnight St",,No,Flipkart,114.csv
386,FK_20251011_142019_3,,,4.5,,,,"Apple Watch Series 8, 41mm GPS + Cellular ECG app, Temperature sensor, Crash Detection  (Midnight St",,No,Flipkart,114.csv
387,FK_20251011_135407_1,Simply awesome,VERY NICE PRODUCTREAD MORE,4.4,"Sep, 2018",Sushanta Dutta,Amit Maurya,"DELL KB216 Multimedia Keyboard with USB Interface, Plunger Keys Technology & Chiclet Wired USB Stand",,Yes,Flipkart,70.csv
388,FK_20251011_135407_3,,,4.4,,,,"DELL KB216 Multimedia Keyboard with USB Interface, Plunger Keys Technology & Chiclet Wired USB Stand",,No,Flipkart,70.csv
389,FK_20251011_144013_1,Just wow! but not for student.,"It's a 1 month review about this product.Battry and Charging:-Using online class 9 hours per day and its still remain 10-15% charging percent.Best and battery and charging.Screen quality is also good.only missing thing is, it should be support realme pen.or everything is okay.who wants it to buy for normal purpose go and buy. but if you are a student and this doesn't provide notes making solution or realme pen for student its not good. in today's era every student sh...READ MORE",4.4,"Aug, 2023",Praveen Prabhakar,shaik abrar,realme Pad 2 8 GB RAM 256 GB ROM 11.5 inch with 4G Tablet (Inspiration Green),,Yes,Flipkart,245.csv
390,FK_20251011_144013_2,,,4.4,,,,realme Pad 2 8 GB RAM 256 GB ROM 11.5 inch with 4G Tablet (Inspiration Green),,No,Flipkart,245.csv
391,FK_20251011_143949_3,,,4.4,,,,realme Pad 2 8 GB RAM 256 GB ROM 11.5 inch with 4G Tablet (Imagination Grey),,No,Flipkart,245.csv
392,FK_20251011_135407_2,,,4.4,,,,"DELL KB216 Multimedia Keyboard with USB Interface, Plunger Keys Technology & Chiclet Wired USB Stand",,No,Flipkart,70.csv
393,FK_20251011_145550_1,Best book ever on the subject  - and written by the creators!,"The subject of design patterns is quite old (formalised in the mid nineties). There are dozens of books and tutorials on the subject - a few of them quite bulky too. Millions of designers and developers use DP everyday but few understand their true application and optimum usage. And, fewer people can explain the subject in a concise yet usable manner.This book is the one that says the least about patterns and opens up all about patterns. It is surprisingly detailed and, at the same time, co...READ MORE",4.4,"Feb, 2022",Sayan Mukherjee,Arka bandyopadhyay,"Design Patterns  (English, Hardcover, Gamma Erich)",,Yes,Flipkart,149.csv
394,FK_20251011_145550_2,,,4.4,,,,"Design Patterns  (English, Hardcover, Gamma Erich)",,No,Flipkart,149.csv
395,FK_20251011_145550_3,,,4.4,,,,"Design Patterns  (English, Hardcover, Gamma Erich)",,No,Flipkart,149.csv
396,FK_20251011_145658_1,,,4.4,,,,,,No,Flipkart,149.csv
397,FK_20251011_145659_5,,,4.4,,,,,,No,Flipkart,149.csv
398,FK_20251011_145525_4,,,4.4,,,,"Java Programming  (English, Paperback, Joel Murach , Anne Boehm)",,No,Flipkart,149.csv
399,FK_20251011_145811_5,,,4.4,,,,,,No,Flipkart,149.csv
400,FK_20251011_132523_1,Fabulous!,"Has been a great purchase. Got it at 49K with card offers. And at that price, couldn't have asked for anything better. A perfect allrounder.Pros -- Premium build- Good speakers (Turn on the Dolby atmos)- Battery life is fairly decent ( I keep the charging life capped at 80%, you get that option just like Samsung phones. That actually keeps your battery life better - My battery cycle is generally between 20% to 80% which gives me around 5hrs of SOT. If you charge it to 100% you might ge...READ MORE",4.4,"Jul, 2024",Prayas Pramanick,Flipkart Customer,Samsung Galaxy Book4 Metal Intel Core i5 13th Gen 1335U - (16 GB/512 GB SSD/Windows 11 Home) NP750XG,,Yes,Flipkart,56.csv
401,FK_20251011_143858_3,,,4.4,,,,realme Pad 2 6 GB RAM 128 GB ROM 11.5 inch with 4G Tablet (Imagination Grey),,No,Flipkart,245.csv
402,FK_20251011_144224_2,,,4.4,,,,Whirlpool 10 kg Ace XL Semi Automatic Top Load Washing Machine Grey  (MAGIC CLEAN 10 DMIX GREY DAZZL,,No,Flipkart,245.csv
403,FK_20251011_143858_1,Just wow! but not for student.,"It's a 1 month review about this product.Battry and Charging:-Using online class 9 hours per day and its still remain 10-15% charging percent.Best and battery and charging.Screen quality is also good.only missing thing is, it should be support realme pen.or everything is okay.who wants it to buy for normal purpose go and buy. but if you are a student and this doesn't provide notes making solution or realme pen for student its not good. in today's era every student sh...READ MORE",4.4,"Aug, 2023",Praveen Prabhakar,shaik abrar,realme Pad 2 6 GB RAM 128 GB ROM 11.5 inch with 4G Tablet (Imagination Grey),,Yes,Flipkart,245.csv
404,FK_20251011_144251_2,,,4.4,,,,"Whirlpool 9 kg 5 Star with Auto Restart, End of Cycle Buzzer, Lint Filter and Collar Scrubber Semi A",,No,Flipkart,245.csv
405,FK_20251011_144251_1,Brilliant,Never think even a moment to buy this product...i hv been using this washing machine for 2 months... excellent performance everything is more than ok..this is better than lg sumsung godrej.. because I used all these bran but I like most Whirlpool.... generally I don't write review but this product urge me to write..thank you Whirlpool for this best product...i m so happy to use this oneREAD MORE,4.4,"Jun, 2023",Suman  Kumar,Swapnil Girkar,"Whirlpool 9 kg 5 Star with Auto Restart, End of Cycle Buzzer, Lint Filter and Collar Scrubber Semi A",,Yes,Flipkart,245.csv
