SNo,Review_ID,Review_Title,Review_Text,Rating,Date_Time,Reviewer_Name,Location,Product_Name,Category,Verified_Purchase,Site,Source_File
1,FK_20251011_135407_11,Professional reviewer here,"Hi,I'm a professional reviewer.PROS:1- Excellent for typing work (I'm a content marketer)2- The build quality is excellent.3- The wire and USB cable quality is outstanding.4 - Compact and sleek5- Reasonable price.6- Media buttons (Mute, Volume Up, and Down work correctly.)I have purchased a Dell mouse and keyboard. The mouse turned into a disappointed but Keyboard is excellent.CONS:1- Print Screen, Scroll Lock. pause break buttons are added to Insert, Home, and PgUp.Overall,...READ MORE",5.0,"Nov, 2017",Krishna Kumar Silvery,,"DELL KB216 Multimedia Keyboard with USB Interface, Plunger Keys Technology & Chiclet Wired USB Stand",,Yes,Flipkart,70.csv
2,FK_20251011_135407_10,Great product,This keyboard keys very soft. When you use this keyboard you feel very comfortable and professional 😊READ MORE,5.0,"Nov, 2020",Mohd Aman,,"DELL KB216 Multimedia Keyboard with USB Interface, Plunger Keys Technology & Chiclet Wired USB Stand",,Yes,Flipkart,70.csv
3,FK_20251011_135407_9,Great product,Value for money. Highly recommended.READ MORE,5.0,"Apr, 2019",ABHISHEK GHOSH,,"DELL KB216 Multimedia Keyboard with USB Interface, Plunger Keys Technology & Chiclet Wired USB Stand",,Yes,Flipkart,70.csv
4,FK_20251011_135407_8,Excellent,Good product from flipkartKeyboard has a soft touch. Overall appearance is also goodPackaging is also perfectAll multimedia function are attachedRecommend to all those who are looking for good quality andAlso supports windows 10 OSREAD MORE,5.0,"May, 2019",Somak Acharya,,"DELL KB216 Multimedia Keyboard with USB Interface, Plunger Keys Technology & Chiclet Wired USB Stand",,Yes,Flipkart,70.csv
5,FK_20251011_135407_7,Simply awesome,this is called brand exactly same as the the shown in the picture so just go for it if you are looking for a perfect keyboard for typing this is amazing product thank you so much.READ MORE,5.0,"Oct, 2019",Upendra Sharma,,"DELL KB216 Multimedia Keyboard with USB Interface, Plunger Keys Technology & Chiclet Wired USB Stand",,Yes,Flipkart,70.csv
6,FK_20251011_135407_6,Terrific,"Thme most simplest and slimmest DELL ever keyboard for all rounding purpose (GAMING, OFFICE, STUDENT)READ MORE",5.0,"Mar, 2018",Bhuvanagiri Gireesh,,"DELL KB216 Multimedia Keyboard with USB Interface, Plunger Keys Technology & Chiclet Wired USB Stand",,Yes,Flipkart,70.csv
7,FK_20251011_135407_5,Simply awesome,VERY NICE PRODUCTREAD MORE,5.0,"Feb, 2019",Sushanta Dutta,,"DELL KB216 Multimedia Keyboard with USB Interface, Plunger Keys Technology & Chiclet Wired USB Stand",,Yes,Flipkart,70.csv
8,FK_20251011_135407_4,Simply awesome,VERY NICE PRODUCTREAD MORE,5.0,"Sep, 2018",Sushanta Dutta,Amit Maurya,"DELL KB216 Multimedia Keyboard with USB Interface, Plunger Keys Technology & Chiclet Wired USB Stand",,Yes,Flipkart,70.csv
9,FK_20251011_135342_14,Classy product,GoodREAD MORE,5.0,"Aug, 2022",Snehal Kesarkar,,"HP 330 Mouse & Keyboard Combo Wireless Standard Desktop Keyboard Compatible with Desktop, Laptop, Ma",,Yes,Flipkart,70.csv
10,FK_20251011_135342_12,Super!,It's working good.READ MORE,5.0,"Oct, 2022",Hari Pradhan,,"HP 330 Mouse & Keyboard Combo Wireless Standard Desktop Keyboard Compatible with Desktop, Laptop, Ma",,Yes,Flipkart,70.csv
11,FK_20251011_135342_10,Brilliant,I am using this product last one year. This product is really good and it's performance understanding. I use these keyboard and mouse atleast 5-7 hours in a day.READ MORE,5.0,"Sep, 2023",Bhupendra  Jadaun,,"HP 330 Mouse & Keyboard Combo Wireless Standard Desktop Keyboard Compatible with Desktop, Laptop, Ma",,Yes,Flipkart,70.csv
12,FK_20251011_141956_4,Perfect product!,Premium watch in this price range. Noise Fit App support is very bad.But watch is very goodREAD MORE,5.0,,Irfan Pathan,7 months ago,"Noise Pro 6 1.85'' Amoled Dispay with A Watch Faces & AI Companion Smartwatch  (Ice Blue Strap, Regu",,Yes,Flipkart,114.csv
13,FK_20251011_141932_13,Best in the market!,SuperREAD MORE,5.0,,Sachin Kumar,5 months ago,"GameSir Silver T800 Ultra Smartwatch Stainless Steel, BT Calling, Fitness & Music Smartwatch  (Silve",,Yes,Flipkart,114.csv
14,FK_20251011_141932_12,Best in the market!,BestREAD MORE,5.0,,Kaustav Saha,5 months ago,"GameSir Silver T800 Ultra Smartwatch Stainless Steel, BT Calling, Fitness & Music Smartwatch  (Silve",,Yes,Flipkart,114.csv
15,FK_20251011_141932_10,Worth every penny,Superb battery lifeREAD MORE,5.0,,Flipkart Customer,6 months ago,"GameSir Silver T800 Ultra Smartwatch Stainless Steel, BT Calling, Fitness & Music Smartwatch  (Silve",,Yes,Flipkart,114.csv
16,FK_20251011_141932_9,Excellent,Nice look smart watch 👍👍READ MORE,5.0,,Flipkart Customer,4 months ago,"GameSir Silver T800 Ultra Smartwatch Stainless Steel, BT Calling, Fitness & Music Smartwatch  (Silve",,Yes,Flipkart,114.csv
17,FK_20251011_141932_8,Fabulous!,Thank you this product is best and quality is also very good...and it is amazing this watch is very low price and high featuresREAD MORE,5.0,,Taashu singh,8 months ago,"GameSir Silver T800 Ultra Smartwatch Stainless Steel, BT Calling, Fitness & Music Smartwatch  (Silve",,Yes,Flipkart,114.csv
18,FK_20251011_141932_7,Awesome,"The smartwatch is an excellent blend of style and functionality, offering seamless connectivity and accurate fitness tracking.READ MORE",5.0,,Reena Nagpal,8 months ago,"GameSir Silver T800 Ultra Smartwatch Stainless Steel, BT Calling, Fitness & Music Smartwatch  (Silve",,Yes,Flipkart,114.csv
19,FK_20251011_142019_6,Super!,Amazing watch 😍READ MORE,5.0,"Oct, 2023",Flipkart Customer,,"Apple Watch Series 8, 41mm GPS + Cellular ECG app, Temperature sensor, Crash Detection  (Midnight St",,Yes,Flipkart,114.csv
20,FK_20251011_142019_5,Highly recommended,Nice design with awesome features..Loving it😍😍READ MORE,5.0,"Sep, 2022",Rajeev Kumar,,"Apple Watch Series 8, 41mm GPS + Cellular ECG app, Temperature sensor, Crash Detection  (Midnight St",,Yes,Flipkart,114.csv
21,FK_20251011_142019_4,Highly recommended,Nice design with awesome features..Loving it😍😍READ MORE,5.0,"Oct, 2022",Rajeev Kumar,Arsh Deep,"Apple Watch Series 8, 41mm GPS + Cellular ECG app, Temperature sensor, Crash Detection  (Midnight St",,Yes,Flipkart,114.csv
22,FK_20251011_141956_13,Wonderful,Perfect watch for daily with premium look!READ MORE,5.0,,Rajan Bhattacharjee,7 months ago,"Noise Pro 6 1.85'' Amoled Dispay with A Watch Faces & AI Companion Smartwatch  (Ice Blue Strap, Regu",,Yes,Flipkart,114.csv
23,FK_20251011_141956_12,Must buy!,Very good watchREAD MORE,5.0,,Imamul Hak,6 months ago,"Noise Pro 6 1.85'' Amoled Dispay with A Watch Faces & AI Companion Smartwatch  (Ice Blue Strap, Regu",,Yes,Flipkart,114.csv
24,FK_20251011_141956_11,Must buy!,Very good product 👍READ MORE,5.0,,Rajat Tarei,5 months ago,"Noise Pro 6 1.85'' Amoled Dispay with A Watch Faces & AI Companion Smartwatch  (Ice Blue Strap, Regu",,Yes,Flipkart,114.csv
25,FK_20251011_141956_10,Terrific,Very good productREAD MORE,5.0,,Sonam Singh,5 months ago,"Noise Pro 6 1.85'' Amoled Dispay with A Watch Faces & AI Companion Smartwatch  (Ice Blue Strap, Regu",,Yes,Flipkart,114.csv
26,FK_20251011_141956_9,Just wow!,It feel as a luxury watchREAD MORE,5.0,,Flipkart Customer,4 months ago,"Noise Pro 6 1.85'' Amoled Dispay with A Watch Faces & AI Companion Smartwatch  (Ice Blue Strap, Regu",,Yes,Flipkart,114.csv
27,FK_20251011_141956_8,Super!,Great watchREAD MORE,5.0,,Sumanta Adhikary,8 months ago,"Noise Pro 6 1.85'' Amoled Dispay with A Watch Faces & AI Companion Smartwatch  (Ice Blue Strap, Regu",,Yes,Flipkart,114.csv
28,FK_20251011_141956_7,Terrific purchase,Wathch is good but strap is off too much bad material please make it well otherwise it's wort buying gadgetREAD MORE,5.0,,Sahil Kurali,4 months ago,"Noise Pro 6 1.85'' Amoled Dispay with A Watch Faces & AI Companion Smartwatch  (Ice Blue Strap, Regu",,Yes,Flipkart,114.csv
29,FK_20251011_141956_6,Mind-blowing purchase,Arcetic wave. A very good product from noise. Just go for it.READ MORE,5.0,,Sayak Dutta,7 months ago,"Noise Pro 6 1.85'' Amoled Dispay with A Watch Faces & AI Companion Smartwatch  (Ice Blue Strap, Regu",,Yes,Flipkart,114.csv
30,FK_20251011_141956_5,Perfect product!,Premium watch in this price range. Noise Fit App support is very bad.But watch is very goodREAD MORE,5.0,,Irfan Pathan,8 months ago,"Noise Pro 6 1.85'' Amoled Dispay with A Watch Faces & AI Companion Smartwatch  (Ice Blue Strap, Regu",,Yes,Flipkart,114.csv
31,FK_20251011_135342_9,Must buy!,Very nice 🙂👍READ MORE,5.0,"Sep, 2022",BEGADA Naveen Kumar,,"HP 330 Mouse & Keyboard Combo Wireless Standard Desktop Keyboard Compatible with Desktop, Laptop, Ma",,Yes,Flipkart,70.csv
32,FK_20251011_135342_6,Highly recommended,Excellent resultREAD MORE,5.0,"Oct, 2022",SUNIL KUMAR,,"HP 330 Mouse & Keyboard Combo Wireless Standard Desktop Keyboard Compatible with Desktop, Laptop, Ma",,Yes,Flipkart,70.csv
33,FK_20251011_135342_5,Terrific,A good external chiclet keyboardREAD MORE,5.0,"Sep, 2022",Armin Phulkar,,"HP 330 Mouse & Keyboard Combo Wireless Standard Desktop Keyboard Compatible with Desktop, Laptop, Ma",,Yes,Flipkart,70.csv
34,FK_20251011_135342_4,Terrific,A good external chiclet keyboardREAD MORE,5.0,"Aug, 2022",Armin Phulkar,Snehal Kesarkar,"HP 330 Mouse & Keyboard Combo Wireless Standard Desktop Keyboard Compatible with Desktop, Laptop, Ma",,Yes,Flipkart,70.csv
35,FK_20251011_135318_12,Best in the market!,I like itREAD MORE,5.0,"Jun, 2024",jitendra kumar,,"Portronics Bubble Dock Bluetooth, Wireless Handheld Multi-device Keyboard Compatible with Desktop, L",,Yes,Flipkart,70.csv
36,FK_20251011_135318_11,Excellent,"Amazing productIt should have some weight, because the tablet is tilting on one side when kept in that groove.Rest the product is amazing and amazing built qualityREAD MORE",5.0,"Aug, 2024",Flipkart Customer,,"Portronics Bubble Dock Bluetooth, Wireless Handheld Multi-device Keyboard Compatible with Desktop, L",,Yes,Flipkart,70.csv
37,FK_20251011_135318_8,Must buy!,"Very useful keyboard to type on Android phone and iPad 9 as well as pc... When delivered i was not able to connect Bluetooth to mobile. So I asked for return, but as paired device limit of mobile was reached it was unable to pair.. as I removed some paired device then this keyboard connected quickly... Liked the product... Bought for 900.READ MORE",5.0,"Jul, 2024",shardul kadam,,"Portronics Bubble Dock Bluetooth, Wireless Handheld Multi-device Keyboard Compatible with Desktop, L",,Yes,Flipkart,70.csv
38,FK_20251011_142043_6,Super!,"Loved the product.I had used all other brands like realme, noise, nothing but this watch gives me unique feel.First of all its Titan Brand and along with it it's display size is perfect not too small not too big.The features are working good and accurate. And also it's battery life is more than 1 week even with calling function ON.READ MORE",5.0,,Sagar Patel,8 months ago,Titan Crest-1.43''|Premium Design|AMOLED|AOD|Working Crown|BT Calling|Fast Charge|IP68 Smartwatch  (,,Yes,Flipkart,114.csv
39,FK_20251011_142043_5,Great product,Very Very nice picREAD MORE,5.0,"Oct, 2024",Flipkart Customer,,Titan Crest-1.43''|Premium Design|AMOLED|AOD|Working Crown|BT Calling|Fast Charge|IP68 Smartwatch  (,,Yes,Flipkart,114.csv
40,FK_20251011_142043_4,Great product,Very Very nice picREAD MORE,5.0,"Oct, 2024",Flipkart Customer,6 months ago,Titan Crest-1.43''|Premium Design|AMOLED|AOD|Working Crown|BT Calling|Fast Charge|IP68 Smartwatch  (,,Yes,Flipkart,114.csv
41,FK_20251011_142019_14,Classy product,best in class ultimate go for cellular alwaysREAD MORE,5.0,"Oct, 2022",Arsh Deep,,"Apple Watch Series 8, 41mm GPS + Cellular ECG app, Temperature sensor, Crash Detection  (Midnight St",,Yes,Flipkart,114.csv
42,FK_20251011_142019_13,Great product,Very goodREAD MORE,5.0,"May, 2023",abin joy,,"Apple Watch Series 8, 41mm GPS + Cellular ECG app, Temperature sensor, Crash Detection  (Midnight St",,Yes,Flipkart,114.csv
43,FK_20251011_142019_12,Wonderful,"This device is very purposefully developed and I have a purpose to fulfill. I always wanted to have a device that will let me connected to today's world but at the same time I don't want to get distracted by unnecessary things. And in my opinion, there is no better device than this for this purpose. My screen is dramatically reduced by 35% in just 7days. I hope it will help me a lot in the coming days.READ MORE",5.0,"Oct, 2023",Aniruddha Pandey,,"Apple Watch Series 8, 41mm GPS + Cellular ECG app, Temperature sensor, Crash Detection  (Midnight St",,Yes,Flipkart,114.csv
44,FK_20251011_142019_11,Super!,This watch is value for money. Flipkart has given a very good offer. Thank you FilpkartREAD MORE,5.0,"Oct, 2023",Mohammed  Khadeer,,"Apple Watch Series 8, 41mm GPS + Cellular ECG app, Temperature sensor, Crash Detection  (Midnight St",,Yes,Flipkart,114.csv
45,FK_20251011_142019_10,Just wow!,Watch with Class.Baap of all Smartwatch.READ MORE,5.0,"Jun, 2023",Puneet Garg,,"Apple Watch Series 8, 41mm GPS + Cellular ECG app, Temperature sensor, Crash Detection  (Midnight St",,Yes,Flipkart,114.csv
46,FK_20251011_142019_9,Great product,Superb ProductREAD MORE,5.0,"Oct, 2023",Vikash Rajput,,"Apple Watch Series 8, 41mm GPS + Cellular ECG app, Temperature sensor, Crash Detection  (Midnight St",,Yes,Flipkart,114.csv
47,FK_20251011_142019_8,Fabulous!,Value for 💰READ MORE,5.0,"Jun, 2023",Shopping Lover,,"Apple Watch Series 8, 41mm GPS + Cellular ECG app, Temperature sensor, Crash Detection  (Midnight St",,Yes,Flipkart,114.csv
48,FK_20251011_142019_7,Great product,"Nice watch, I have never experienced this type of watch. Display is good, strap quality is also good excellent performance. Over all it was a great product from AppleREAD MORE",5.0,"Jan, 2023",Palla Kranti Kumar,,"Apple Watch Series 8, 41mm GPS + Cellular ECG app, Temperature sensor, Crash Detection  (Midnight St",,Yes,Flipkart,114.csv
49,FK_20251011_135252_14,Awesome,very very good product.... thanks to flipkartREAD MORE,5.0,"Jun, 2019",Keshav  Mishra,,"HP wireless keyboard & mouse combo Wireless Standard Laptop Keyboard Compatible with Desktop, Laptop",,Yes,Flipkart,70.csv
50,FK_20251011_135252_12,Perfect product!,Iam very much satisfiedVery smooth and fast response and easy to connectGiven a off/on button for mouseIf it also present for key board it will be Very useful but not providedAny how 2 items are atomatically going to stand by mode if we not used for a whileREAD MORE,5.0,"Nov, 2020",Saiuday Bandaru,,"HP wireless keyboard & mouse combo Wireless Standard Laptop Keyboard Compatible with Desktop, Laptop",,Yes,Flipkart,70.csv
51,FK_20251011_135252_9,Best in the market!,very good product and very soft keyboard and and mouse very nice I am happyREAD MORE,5.0,"Oct, 2019",MANOJ KUMAR  GOPE,,"HP wireless keyboard & mouse combo Wireless Standard Laptop Keyboard Compatible with Desktop, Laptop",,Yes,Flipkart,70.csv
52,FK_20251011_135252_7,Super!,Awesome product very good looking very smooth mouse and stylish keyboard.❤️READ MORE,5.0,"Feb, 2020",Gurjeet Singh,,"HP wireless keyboard & mouse combo Wireless Standard Laptop Keyboard Compatible with Desktop, Laptop",,Yes,Flipkart,70.csv
53,FK_20251011_135252_6,Worth every penny,awesome productREAD MORE,5.0,"Nov, 2019",Deepak Patel,,"HP wireless keyboard & mouse combo Wireless Standard Laptop Keyboard Compatible with Desktop, Laptop",,Yes,Flipkart,70.csv
54,FK_20251011_142106_8,Simply awesome,AwasomREAD MORE,5.0,,Vibeesh Vp,8 months ago,"Promate Xwatch-R19 Smartwatch  (MNG Strap, Free Size)",,Yes,Flipkart,114.csv
55,FK_20251011_142106_5,Worth every penny,GoodREAD MORE,5.0,"Sep, 2024",Aonu Das,,"Promate Xwatch-R19 Smartwatch  (MNG Strap, Free Size)",,Yes,Flipkart,114.csv
56,FK_20251011_142106_4,Worth every penny,GoodREAD MORE,5.0,"Jul, 2024",Aonu Das,8 months ago,"Promate Xwatch-R19 Smartwatch  (MNG Strap, Free Size)",,Yes,Flipkart,114.csv
57,FK_20251011_142043_14,Mind-blowing purchase,It's okayREAD MORE,5.0,,Khushi Shandilya,6 months ago,Titan Crest-1.43''|Premium Design|AMOLED|AOD|Working Crown|BT Calling|Fast Charge|IP68 Smartwatch  (,,Yes,Flipkart,114.csv
58,FK_20251011_142043_11,Super!,Best value for money.READ MORE,5.0,,Bikash  Ghorai,10 months ago,Titan Crest-1.43''|Premium Design|AMOLED|AOD|Working Crown|BT Calling|Fast Charge|IP68 Smartwatch  (,,Yes,Flipkart,114.csv
59,FK_20251011_142043_10,Super!,Amazing watchREAD MORE,5.0,,Puneet Thakur,6 months ago,Titan Crest-1.43''|Premium Design|AMOLED|AOD|Working Crown|BT Calling|Fast Charge|IP68 Smartwatch  (,,Yes,Flipkart,114.csv
60,FK_20251011_142742_5,Just wow!,"I took delivery 10 days back and I did a little research on TVs online and store Visit before buying this TV, So here is my 10 day review.Running is smooth, Runs on FireOs, Alexa works properly, sound is good for Normal use of you need Extra loud soud you need to go for additional sound Bars, Display is very similar as compared to 60k-70k TVs in Market like Sony, Samsung etc. I prefer you should go if You are getting this between 30K to 40K.Only problem for me is that it took around 10 d...READ MORE",5.0,"Sep, 2024",Guru salgare,3 months ago,XIAOMI by Mi FX Pro 108 cm (43 inch) QLED Ultra HD (4K) Smart Fire TV 2025 Edition with Alexa built-,,Yes,Flipkart,57.csv
61,FK_20251011_142716_5,Just wow!,"I took delivery 10 days back and I did a little research on TVs online and store Visit before buying this TV, So here is my 10 day review.Running is smooth, Runs on FireOs, Alexa works properly, sound is good for Normal use of you need Extra loud soud you need to go for additional sound Bars, Display is very similar as compared to 60k-70k TVs in Market like Sony, Samsung etc. I prefer you should go if You are getting this between 30K to 40K.Only problem for me is that it took around 10 d...READ MORE",5.0,"Sep, 2024",Guru salgare,3 months ago,XIAOMI by Mi X Pro CineMagiQLED 108 cm (43 inch) QLED Ultra HD (4K) Smart Google TV 2025 Edition wit,,Yes,Flipkart,57.csv
62,FK_20251011_142625_14,Terrific purchase,"Excellent Product from Samsung, Just go with it. Superb remote with Voice Assistance.READ MORE",5.0,"Sep, 2024",Dr Ravineet Singh,,Samsung Crystal 4K Infinity Vision 108 cm (43 inch) Ultra HD (4K) LED Smart Tizen TV 2025 Edition wi,,Yes,Flipkart,57.csv
63,FK_20251011_142625_13,Brilliant,Don't Go Behind Negative Reviews Every Product has Some Pros And Cons But It Has Value For Money If You Buy In Sale ......READ MORE,5.0,"Jan, 2024",Bheemraj  Yadav,,Samsung Crystal 4K Infinity Vision 108 cm (43 inch) Ultra HD (4K) LED Smart Tizen TV 2025 Edition wi,,Yes,Flipkart,57.csv
64,FK_20251011_142625_12,Terrible product,Very good product clear picture quality i am very happy purchased this productREAD MORE,5.0,"Oct, 2023",bhawani saini,,Samsung Crystal 4K Infinity Vision 108 cm (43 inch) Ultra HD (4K) LED Smart Tizen TV 2025 Edition wi,,Yes,Flipkart,57.csv
65,FK_20251011_142625_11,Great product,"Tv is good worth the choice, bluetooth, wifi picture clarity is all good only sound output is less. Reviewing after 6 months of usageREAD MORE",5.0,"Apr, 2024",Flipkart Customer,,Samsung Crystal 4K Infinity Vision 108 cm (43 inch) Ultra HD (4K) LED Smart Tizen TV 2025 Edition wi,,Yes,Flipkart,57.csv
66,FK_20251011_142625_9,Just wow!,"Superb LED TV,  first I was going to make an order for 55 inch ismart model since that was cheaper 2k but finally considering the upgrade, I decided to buy this one and I feel, I made the right decision.Now come to the product..The bezels are thin from three sides, sound quality is good for 120-150 sqft room, display quality is amazing. The colors are natural tending to a cooler tone. Voice command through Alexa is far better than Bixby. Overall software experience is snappy.Remote has so...READ MORE",5.0,"Aug, 2023",Fahed  Khan,,Samsung Crystal 4K Infinity Vision 108 cm (43 inch) Ultra HD (4K) LED Smart Tizen TV 2025 Edition wi,,Yes,Flipkart,57.csv
67,FK_20251011_142625_7,Highly recommended,Excellent Picture and sound QualityGood connectivity and portabilityREAD MORE,5.0,"Dec, 2023",HARISH P NADAR,,Samsung Crystal 4K Infinity Vision 108 cm (43 inch) Ultra HD (4K) LED Smart Tizen TV 2025 Edition wi,,Yes,Flipkart,57.csv
68,FK_20251011_142625_5,Excellent,"Amazing Picture clarity,Good sound if you connect Sound Bar then It's purely out of the heart beat....Just go for it.Worthy of every penny spent.READ MORE",5.0,"May, 2024",ANIL  YADAV VEERABOINA,,Samsung Crystal 4K Infinity Vision 108 cm (43 inch) Ultra HD (4K) LED Smart Tizen TV 2025 Edition wi,,Yes,Flipkart,57.csv
69,FK_20251011_142625_4,Excellent,"Amazing Picture clarity,Good sound if you connect Sound Bar then It's purely out of the heart beat....Just go for it.Worthy of every penny spent.READ MORE",5.0,"Sep, 2024",ANIL  YADAV VEERABOINA,Dr Ravineet Singh,Samsung Crystal 4K Infinity Vision 108 cm (43 inch) Ultra HD (4K) LED Smart Tizen TV 2025 Edition wi,,Yes,Flipkart,57.csv
70,FK_20251011_142132_13,Wonderful,Perfect watch for daily with premium look!READ MORE,5.0,,Rajan Bhattacharjee,7 months ago,Noise Pro 6 1.85'' Amoled Dispay with AI Watch Faces & AI Companion Smartwatch  (Champagne Link Stra,,Yes,Flipkart,114.csv
71,FK_20251011_142132_12,Must buy!,Very good watchREAD MORE,5.0,,Imamul Hak,6 months ago,Noise Pro 6 1.85'' Amoled Dispay with AI Watch Faces & AI Companion Smartwatch  (Champagne Link Stra,,Yes,Flipkart,114.csv
72,FK_20251011_142132_11,Must buy!,Very good product 👍READ MORE,5.0,,Rajat Tarei,5 months ago,Noise Pro 6 1.85'' Amoled Dispay with AI Watch Faces & AI Companion Smartwatch  (Champagne Link Stra,,Yes,Flipkart,114.csv
73,FK_20251011_142132_10,Terrific,Very good productREAD MORE,5.0,,Sonam Singh,5 months ago,Noise Pro 6 1.85'' Amoled Dispay with AI Watch Faces & AI Companion Smartwatch  (Champagne Link Stra,,Yes,Flipkart,114.csv
74,FK_20251011_142132_9,Just wow!,It feel as a luxury watchREAD MORE,5.0,,Flipkart Customer,4 months ago,Noise Pro 6 1.85'' Amoled Dispay with AI Watch Faces & AI Companion Smartwatch  (Champagne Link Stra,,Yes,Flipkart,114.csv
75,FK_20251011_142132_8,Super!,Great watchREAD MORE,5.0,,Sumanta Adhikary,8 months ago,Noise Pro 6 1.85'' Amoled Dispay with AI Watch Faces & AI Companion Smartwatch  (Champagne Link Stra,,Yes,Flipkart,114.csv
76,FK_20251011_142132_7,Terrific purchase,Wathch is good but strap is off too much bad material please make it well otherwise it's wort buying gadgetREAD MORE,5.0,,Sahil Kurali,4 months ago,Noise Pro 6 1.85'' Amoled Dispay with AI Watch Faces & AI Companion Smartwatch  (Champagne Link Stra,,Yes,Flipkart,114.csv
77,FK_20251011_142132_6,Mind-blowing purchase,Arcetic wave. A very good product from noise. Just go for it.READ MORE,5.0,,Sayak Dutta,7 months ago,Noise Pro 6 1.85'' Amoled Dispay with AI Watch Faces & AI Companion Smartwatch  (Champagne Link Stra,,Yes,Flipkart,114.csv
78,FK_20251011_142132_5,Perfect product!,Premium watch in this price range. Noise Fit App support is very bad.But watch is very goodREAD MORE,5.0,,Irfan Pathan,8 months ago,Noise Pro 6 1.85'' Amoled Dispay with AI Watch Faces & AI Companion Smartwatch  (Champagne Link Stra,,Yes,Flipkart,114.csv
79,FK_20251011_142132_4,Perfect product!,Premium watch in this price range. Noise Fit App support is very bad.But watch is very goodREAD MORE,5.0,,Irfan Pathan,7 months ago,Noise Pro 6 1.85'' Amoled Dispay with AI Watch Faces & AI Companion Smartwatch  (Champagne Link Stra,,Yes,Flipkart,114.csv
80,FK_20251011_142600_13,Fabulous!,"I really liked this Indian product iffalcon by TCL company's TV, this product is no less than a brand. me and my family liked it very much.READ MORE",5.0,,Kishan  Bhadradiya,4 months ago,iFFALCON by TCL U65 138 cm (55 inch) Ultra HD (4K) LED Smart Google TV 2025 Edition with MEMC | Dolb,,Yes,Flipkart,57.csv
81,FK_20251011_142600_10,Highly recommended,Best quelityREAD MORE,5.0,,Mallikarjun Hallur,4 months ago,iFFALCON by TCL U65 138 cm (55 inch) Ultra HD (4K) LED Smart Google TV 2025 Edition with MEMC | Dolb,,Yes,Flipkart,57.csv
82,FK_20251011_142600_7,Just wow!,"I have been using this product for one week and the picture, sound quality of this TV is awesome.READ MORE",5.0,,Aaditya Sharma,3 months ago,iFFALCON by TCL U65 138 cm (55 inch) Ultra HD (4K) LED Smart Google TV 2025 Edition with MEMC | Dolb,,Yes,Flipkart,57.csv
83,FK_20251011_142600_6,Excellent,ProsMetalic frameSuper fas processerSound quality is goodPicture quality is betterBigger size 55 inchBluetooth remote very fast4 star power rating with annual unit 132 only claim by companyMain feature not required any set top box you will enjoy free to air channel in tvMemc support5 ghz wifi supportApp to app support is excellentVery fast tv in 23500 price range with card offersConsVery heavy due to metallic designFinal conclusionYou are not rich just like me. You also ...READ MORE,5.0,,Chandra Prakash Bora,3 months ago,iFFALCON by TCL U65 138 cm (55 inch) Ultra HD (4K) LED Smart Google TV 2025 Edition with MEMC | Dolb,,Yes,Flipkart,57.csv
84,FK_20251011_142600_5,Brilliant,"Osum, everything is perfect. Sound and picture quality are perfect.Beleive me its better than realme tv.This is 2025 model and buy it blindly. No one will regret.READ MORE",5.0,,Rahul Paladia,4 months ago,iFFALCON by TCL U65 138 cm (55 inch) Ultra HD (4K) LED Smart Google TV 2025 Edition with MEMC | Dolb,,Yes,Flipkart,57.csv
85,FK_20251011_142600_4,Brilliant,"Osum, everything is perfect. Sound and picture quality are perfect.Beleive me its better than realme tv.This is 2025 model and buy it blindly. No one will regret.READ MORE",5.0,,Rahul Paladia,3 months ago,iFFALCON by TCL U65 138 cm (55 inch) Ultra HD (4K) LED Smart Google TV 2025 Edition with MEMC | Dolb,,Yes,Flipkart,57.csv
